Company_name,Company_size,Description,Img_Url,Industry,Job_function,Job_type,Location,Salary,Title,apply_link
Cassia,5001 to 10000 Employees,"Join our award-winning facility as a  a 4-star rated, 140-bed campus, is seeking dedicated  to join our skilled team. In this role, you will join our team of professional caregivers to become an important part of our residents’ lives. We are seeking an individual who is a team player and who is also comfortable working independently. Safety is our number one priority. Staff are provided with personal protective equipment. Here at   you will feel like part of our family as we work together to serve our residents. We believe in your quality of life, too – so you’ll find our culture provides ongoing opportunities to grow (tuition assistance and in-house training), a work/life balance and a commitment to coaching that enables you to be the best you can be. In addition to generous benefits, we're offering a   Don't wait and miss this wonderful opportunity! There are   positions available.  Day (7 am to 11 pm) Baptist Health Care Center of Bismarck provides loving and supportive 24-hour nursing care. Working together with our residents and their families, our professional caregivers develop a care plan tailored to meet each individual’s needs. That plan includes social and spiritual care as well as the health care services needed to maximize our residents’ comfort, security, and well-being. We take pride in providing compassionate care to our residents by focusing on our 8 pillars of excellence (Compassion, Integrity, Excellence, Innovation, Stewardship, Unity, Respect, and Collaboration). Apply today to make a difference in the lives of those we serve! Cassia, an affiliation between Augustana Care and Elim Care, is a Christian mission organization with over 200 years of combined experience caring for those in need. We strive to inspire residents to live the lives that are most fulfilling to them. We take pride in the longevity of our management team and invite you to apply to learn more! #Indeed EOE/AA Employer/Vet/Disabled *A Drug Free Workplace *A Veteran Friendly Employer Powered by JazzHR Bclcl1VQzN certified nursing assistant nursing home certified nursing assistant certified nursing assistant cna certified nursing assistant long term care hospice certified nursing assistant qualified nursing assistant long term care Glassdoor has millions of jobs plus salary information, company reviews, and interview questions from people on the inside making it easy to find a job that’s right for you. Glassdoor Employers Community Work With Us Copyright © 2008–2021, Glassdoor, Inc. ""Glassdoor"" and logo are registered trademarks of Glassdoor, Inc. ",https://media.glassdoor.com/sql/3334656/cassia-mn-squarelogo-1606941234779.png,Health Care,certified nursing assistant,Part-time,"Bismarck, ND",,"Certified Nursing Assistants (CNAs)- PT Day 1,500 Bonus",https://cassia.applytojob.com/apply/Bclcl1VQzN/Certified-Nursing-Assistants-CNAs-PT-Day-1500-Bonus?source=INDE
Missouri Valley Montessori Preschool,N/A,"Preference will be given to an individual who currently holds an Early or Elementary Education Teaching License. The Substitute position will be as needed. Hours will may range from 8:00 am to 5:30 pm. The Substitute will work alongside an Assistant Teacher in a classroom of 19 preschoolers. The Substitute will be responsible to carry out lesson plans. Minimum hourly rate of $15.00 Job Types: Full-time, Temporary Employment Length: instructional aide elementary teacher preschool teacher elementary school teacher teacher elementary school teacher assistant Glassdoor has millions of jobs plus salary information, company reviews, and interview questions from people on the inside making it easy to find a job that’s right for you. Glassdoor Employers Community Work With Us Copyright © 2008–2021, Glassdoor, Inc. ""Glassdoor"" and logo are registered trademarks of Glassdoor, Inc. ",,,substitute teacher,Full-time,"Bismarck, ND",,Substitute Teacher,"https://www.glassdoor.com/job-listing/substitute-teacher-missouri-valley-montessori-preschool-JV_IC1156224_KO0,18_KE19,55.htm?jl=3661425103&pos=124&ao=1044077&s=58&guid=00000177921a43f79cd1aee6a8351ffc&src=GD_JOB_AD&t=SR&vt=w&ea=1&cs=1_bcf49278&cb=1613063931283&jobListingId=3661425103&ctt=1613063949406"
Centennial Homes,51 to 200 Employees,"Finish Carpenter and Warranty Tech Responsibilities include: Complete the final finish/inspection and final walk through with the customer of a manufactured or modular home that is delivered to the customer's job site. Complete all warranty work on the home. Minimum Requirements - Must have construction background and be skilled in tape and texturing of drywall - Must possess a clean driving record - Must pass background screening and a drug screening -Must be able to travel 4-5 days per week. - Experience in Manufactured/Modular housing is preferred but not required if you have a background in related skills. Benefits: We recognize people as our most valuable asset. Our compensation offers a competitive pay and a great benefits package which includes 401K, medical and available dental insurance, life insurance, Flex Cafeteria Plan, paid sick leave, clothing allowance, paid company holidays, job training programs, paid vacations and training. For more information check out our website @ www.careersatcentennialhomes.com Job Type: Full-time Benefits: Experience: Location: License: Required travel: Work Location: Typical start time: Typical end time: Pay Frequency: This Job Is Ideal for Someone Who Is: This Job Is: Company's website: Benefit Conditions: Work Remotely: construction superintendent cabinet maker Glassdoor has millions of jobs plus salary information, company reviews, and interview questions from people on the inside making it easy to find a job that’s right for you. Glassdoor Employers Community Work With Us Copyright © 2008–2021, Glassdoor, Inc. ""Glassdoor"" and logo are registered trademarks of Glassdoor, Inc. ",https://media.glassdoor.com/sql/145501/centennial-homes-squarelogo-1429594663693.png,Real Estate,carpenter,Full-time,"Bismarck, ND",,Finish Carpenter/Warranty Technician,"https://www.glassdoor.com/job-listing/finish-carpenter-warranty-technician-centennial-homes-JV_IC1156224_KO0,36_KE37,53.htm?jl=3674753679&pos=122&ao=1044077&s=58&guid=00000177921a43f79cd1aee6a8351ffc&src=GD_JOB_AD&t=SR&vt=w&ea=1&cs=1_c0a7c9e5&cb=1613063931283&jobListingId=3674753679&ctt=1613063949401"
Penske,10000+ Employees,"Glassdoor has millions of jobs plus salary information, company reviews, and interview questions from people on the inside making it easy to find a job that’s right for you. Glassdoor Employers Community Work With Us Copyright © 2008–2021, Glassdoor, Inc. ""Glassdoor"" and logo are registered trademarks of Glassdoor, Inc. ",https://media.glassdoor.com/sql/8984/penske-truck-leasing-squarelogo-1448305940838.png,Transportation & Logistics,driver,Part-time,"Lincoln, ND",,Non-CDL Local Driver - Hiker/Vehicle Transporter - Part Time,https://gopenske.taleo.net/careersection/.penske.ex.jsa.dr/jobdetail.ftl?job=2101830&src=JB-10126
Northwestern Mutual,5001 to 10000 Employees,"JOIN OUR CHAMPIONSHIP TEAM We are a Fortune 150 company looking to grow! Do you like helping others? Everyone needs financial assistance. Our team helps clients navigate a personalized plan in order to reach their financial dreams! We are searching for three (3) special individuals to join our premier financial planning firm in Fargo, North Dakota. These are mentored positions. No financial experience required. We will train, coach, mentor, and develop the right candidate through our Wealth Management Advisor Program curriculum. Here, you'll have access to award-winning training, technology, planning tools, and supportive mentors who will help you deliver expert advice to your clients. And, as you build impactful relationships with clients and help them build a plan to achieve their financial goals, you'll be solidifying your own financial future too. Hard work is valued here, rewarded with opportunities for growth and exceptional income potential. Do you want a company that values varied experiences and diversity? Do you want a career in which you control your time and flexibility to make your success what you want it? Do you think hard work should be recognized and rewarded? Are teamwork and mentorship important to you? Are you looking for a fast-paced, highly productive environment with driven people surrounding you and rooting you on? THIS CAREER OFFERS YOU: -Stipends for training and licensing to help you get started. -The ability to positively impact someone else's life. -Personalized mentoring from top advisors and award-winning training programs. -Backing by Northwestern Mutual, an industry leader with a proven track record of success. CAN YOU SEE YOURSELF HELPING OTHERS REACH THEIR FINANCIAL GOALS? Many people (50%) find their calling in financial services after working in other industries. Wondering if you’d be a good fit? See how many of the characteristics below match up to you: You know how to connect with people, building personal, trusted relationships. Financial planning is interesting to you. You’re a driven person who’s committed to succeeding. You’re ready to earn more for your hard work. You enjoy helping people make more informed, confident decisions. You're ready to live the life you want, both personally and professionally. QUALIFICATIONS We want people with different backgrounds and work experience, including but not limited to: financial services, sales, educators, athletes, military veterans, real estate agents, and community influencers. We would prefer you to have a Bachelors of Arts or Science degree. It's also a plus if you have strong interpersonal skills and are a self-starter who is motivated and has had personal success. You must be from the area, have lived here for four years, or have a substantial network here. You must have an interest in people and sales! Our advisors consult with people daily. INCOME GROWTH OPPORTUNITY: Average vs Top 25% Year 1 | $52,000 - $106,000 Year 3 | $103,000 - $202,000 Year 5 |$139,000 - $289,000 Year 10 | $234,000 - $490,000 Year 15 | $341,000 - $790,000 Beyond income, you'll also have access to a comprehensive benefits package: Comprehensive medical insurance Two pension plans Life and disability insurance Health care and dependent care reimbursement accounts Reimbursement for licensing and ongoing education About Northwestern Mutual: Northwestern Mutual has been helping families and businesses achieve financial security for over 164 years. Through a distinctive, whole-picture planning approach including both insurance and investments, we empower people to be financially confident. We combine the expertise of our financial professionals with a personalized digital experience and leading-edge technology to best serve our clients. With $250.4 billion in assets, $28.2 billion in revenues, and more than $1.6 trillion worth of life insurance protection in force, Northwestern Mutual delivers financial security to more than 4.4 million people who rely on us for life, disability income and long-term care insurance, annuities, brokerage and advisory services, trust services, and discretionary portfolio management solutions. The company holds more than $100 billion of client assets as a part of its wealth management and investment services. Recent Awards and Accolades: -FORTUNE® 104 (FORTUNE® 500, 2018) -One of the “World’s Most Admired” life insurance companies (FORTUNE® Magazine, 2019) -Best Places to Work #67 (Glassdoor, 2018) -Highest Rated CEO's (Glassdoor, 2017) -50 Best Companies for Diversity (Black Enterprise Magazine, 2018) -50 Best Companies to Sell For (Selling Power Magazine, 2016) Related keywords: finance, financial advisor Job Type: Full-time Pay: $52,000.00 - $300,000.00 per year Benefits: Schedule: Supplemental Pay: Education: Experience: Work Location: Paid Training: This Company Describes Its Culture as: Company's website: Benefit Conditions: COVID-19 Precaution(s): investment consultant financial adviser finance advisor investment advisor financial counselor financial associate Glassdoor has millions of jobs plus salary information, company reviews, and interview questions from people on the inside making it easy to find a job that’s right for you. Glassdoor Employers Community Work With Us Copyright © 2008–2021, Glassdoor, Inc. ""Glassdoor"" and logo are registered trademarks of Glassdoor, Inc. ",https://media.glassdoor.com/sql/2919/northwestern-mutual-squarelogo-1505752677735.png,Finance,financial advisor,Full-time,"Bismarck, ND",,Financial Advisor,"https://www.glassdoor.com/job-listing/financial-advisor-northwestern-mutual-JV_IC1156224_KO0,17_KE18,37.htm?jl=3801955987&pos=126&ao=1044077&s=58&guid=00000177921a43f79cd1aee6a8351ffc&src=GD_JOB_AD&t=SR&vt=w&ea=1&cs=1_40a45c61&cb=1613063931283&jobListingId=3801955987&ctt=1613063949291"
"Schweigert, Klemin & McBride, P.C.",N/A,"Fast-Paced Law Firm looking for a professional paralegal/legal assistant who has a wide range of responsibilities. Tasks would include but not be limited to: Drafting legal documents; drafting and routing correspondence; communicating with clients and other attorney’s offices via email, phone, or in person; managing a complex case load; document and maintain case details; utilizing court filing system. Applicant should have relevant training or qualification and must have knowledge of law office procedures. Applicant should have the following skills: excellent verbal and written communication skills, attention to detail, confidentiality, planning and organizing, information management, integrity, judgment and decision making, motivation, self-starter, and reliable. Job Type: Full-time Pay: $15.00 - $20.00 per hour Benefits: Schedule: Education: Experience: Work Location: Company's website: Benefit Conditions: Work Remotely: law clerk legal analyst litigation paralegal legal secretary legal clerk paralegal specialist Glassdoor has millions of jobs plus salary information, company reviews, and interview questions from people on the inside making it easy to find a job that’s right for you. Glassdoor Employers Community Work With Us Copyright © 2008–2021, Glassdoor, Inc. ""Glassdoor"" and logo are registered trademarks of Glassdoor, Inc. ",,,legal assistant,Full-time,"Bismarck, ND",,Paralegal/Legal Assistant,"https://www.glassdoor.com/job-listing/paralegal-legal-assistant-schweigert-klemin-mcbride-pc-JV_IC1156224_KO0,25_KE26,54.htm?jl=3820616362&pos=128&ao=1044077&s=58&guid=00000177921a43f79cd1aee6a8351ffc&src=GD_JOB_AD&t=SR&vt=w&ea=1&cs=1_304b3f16&cb=1613063931284&jobListingId=3820616362&ctt=1613063949412"
Country Financial,1001 to 5000 Employees,"Description Qualifications claims adjuster experienced sales representative insurance sales representative claims representative state farm agent insurance producer Glassdoor has millions of jobs plus salary information, company reviews, and interview questions from people on the inside making it easy to find a job that’s right for you. Glassdoor Employers Community Work With Us Copyright © 2008–2021, Glassdoor, Inc. ""Glassdoor"" and logo are registered trademarks of Glassdoor, Inc. ",https://media.glassdoor.com/sql/17480/country-financial-squarelogo-1605199598800.png,Insurance,insurance sales agent,Full-time,"Bismarck, ND",,Insurance Agent,https://countryfinancial.avature.net/careers/JobDetail/Bismarck-North-Dakota-United-States-Insurance-Agent/313?source=Indeed
Northland PACE,N/A,"Northland PACE Senior Care Services has at its core the goal of helping people age 55 and older stay healthy, independent, and remain in their homes and communities as long as possible. PACE stands for: P* rogram of *A ll-Inclusive C* are for the E* lederly. : Promotes and maintains the health of enrolled participants through nursing assessment, treatment, teaching and counseling. Responsible for completing enrollment and periodic assessments of health needs to contribute to the individual’s plan of care. Responsible for the implementation of nursing care plan and coordination of nursing with other services. Under limited supervision and in accordance with all applicable federal, state and local laws/regulations: a. Completes RN assessment during initial, semi-annual, annual and significant change evaluations b. Ensures participants care plan is reflective of all nursing interventions and participant diagnoses c. Initiates preventative nursing care procedures as appropriate for the participants’ care and safety d. Completes participant cares scheduled within the day center and in participants homes as needed e. Collaborates with the Home Care Nurse about teaching needs of participants and families f. Implements, directs, evaluates and provides oversight of nursing care and care provided by certified nursing assistants. g. Collaborates with provider to facilitate PACE appointments, participant needs and plans/follow-up for specialty appointments and medical orders h. Assists with preparation for interdisciplinary team meetings and ensuring that all updates for participants and needed appointments are added to the schedule i. Communicates regularly with pharmacy regarding prescription changes and ensuring that participant MAR is up to date j. Provides care to participants in a positive, nurturing, professional manner. k. Provides health teaching to participants with complex nursing needs l. Triages and ensures assessments are completed on participants reporting any sudden illness or onset of illness at home. m. Is flexible and able to adjust schedule to meet complex needs of participants. n. Consults with other staff members regarding any concerns about appointments, complaints or other anticipated/discovered needs identified during assessments. o. Works with social worker regarding family and caregiver in caring for homebound participants. p. Maintains accurate records of all nursing services provided to participant in EMR q. Participates in Quality Improvement activities as requested r. Collaborates with hospital for any participant hospitalized s. Collaborates with nursing facility weekly for any participants residing in nursing facility Education: Degree in nursing from an accredited college or university. Experience: At least two years’ as staff nurse, preferred. One year’s experience with frail or elderly population. Licensure, registry or certification required: Current unencumbered North Dakota Nursing License. Special Training: Must be able to work effectively with an interdisciplinary team. Must be able to communicate effectively. Must possess strong interpersonal and organizational skills. Ability to adapt to change in a positive/professional manner. Must meet standardized competencies for standards of medical care and established for position. Must be medically cleared for communicable diseases. Must have all immunizations up to date before engaging in direct participant contact. Physical Demands: Must be able to see, hear, and verbally communicate. Must be able to move about freely and possess manual dexterity and visual acuity. Must able to lift, turn, and roll over participants. Working Conditions: Primarily inside, well-lit, climate controlled environment. Will require travel in various weather elements (rain, snow, cold, heat etc.) Will require frequent home visits. Potential exposure to infectious disease and environmental hazards. Frequent home visits. Reliable transportation required. Job Type: Full-time Pay: $28.00 - $32.00 per hour Benefits: Medical Specialty: Schedule: Work Location: Employer type: Qualifications: Uniform: Relocation Assistance Provided: Company's website: Company's Facebook page: Benefit Conditions: Work Remotely: COVID-19 Precaution(s): case manager rn medical case manager nicu case manager nurse case manager utilization review nurse registered nurse rn Glassdoor has millions of jobs plus salary information, company reviews, and interview questions from people on the inside making it easy to find a job that’s right for you. Glassdoor Employers Community Work With Us Copyright © 2008–2021, Glassdoor, Inc. ""Glassdoor"" and logo are registered trademarks of Glassdoor, Inc. ",,,registered nurse case manager,Full-time,"Bismarck, ND",,"Clinic Case Manager - Nurse (RN) - Bismarck, ND","https://www.glassdoor.com/job-listing/clinic-case-manager-nurse-rn-bismarck-nd-northland-pace-JV_IC1156224_KO0,40_KE41,55.htm?jl=3779306817&pos=120&ao=1044077&s=58&guid=00000177921a43f79cd1aee6a8351ffc&src=GD_JOB_AD&t=SR&vt=w&ea=1&cs=1_2e1a36aa&cb=1613063931283&jobListingId=3779306817&ctt=1613063954212"
Fargo Glass and Paint,N/A,"Installation of frames and glass at commercial job sites, repair broken residential windows, install and service shower doors. Monday-Friday 8:00am-5:00pm; overtime occasionally This is a full-time position and is benefit eligible. Job Type: Full-time Pay: $19.74 - $24.68 per hour Benefits: Schedule: Experience: License: Labor type: Company's website: Benefit Conditions: Work Remotely: automonteur ordertrekker automotive technicus wagenparkmonteur automotive service technicus automobiel instructeur Glassdoor has millions of jobs plus salary information, company reviews, and interview questions from people on the inside making it easy to find a job that’s right for you. Glassdoor Employers Community Work With Us Copyright © 2008–2021, Glassdoor, Inc. ""Glassdoor"" and logo are registered trademarks of Glassdoor, Inc. ",,,auto glass technician,Full-time,"Bismarck, ND",,Commercial Glass Installer - Glazier,https://www.fargoglass.com/gf-job-app/
Staffing Medical USA,N/A,"RN ICU - PCU / Travel / Covid Response / $3,450 week 48 hours/week Bismarck, ND - Our facility is currently seeking a travel nurse for an ICU/PCU travel assignment in Bismarck, ND. Benefits of this assignment include Day 1 insurance, extension bonus, referral bonus and personal guidance throughout the credentialing process. - 2 recent/professional references A background check, verification of ND/Compact license and certifications will be performed - Previous experience in ICU / PCU is required Previous Travel experience is a plus Must be professional and proficient with patient care - IND - SM - Apply Today! Job Type: Contract Pay: $3,349.00 - $3,350.00 per week Benefits: Medical Specialty: Schedule: Experience: Education: License: Work Remotely: registered nurse case manager registered nurses case manager rn rn medical chart review nurse nurse case manager registered nurse rn Glassdoor has millions of jobs plus salary information, company reviews, and interview questions from people on the inside making it easy to find a job that’s right for you. Glassdoor Employers Community Work With Us Copyright © 2008–2021, Glassdoor, Inc. ""Glassdoor"" and logo are registered trademarks of Glassdoor, Inc. ",,,registered nurse,Full-time,"Bismarck, ND",,"RN ICU / Travel / Covid Response / $3,350 week","https://www.glassdoor.com/job-listing/rn-icu-travel-covid-response-3-350-week-staffing-medical-usa-JV_IC1156224_KO0,39_KE40,60.htm?jl=3708701088&pos=117&ao=1044076&s=58&guid=00000177921a43f79cd1aee6a8351ffc&src=GD_JOB_AD&t=SR&vt=w&ea=1&cs=1_6c80fa62&cb=1613063931282&jobListingId=3708701088&ctt=1613063954202"
Altru Health System,N/A,": $29.19 - $39.22 The Registered Nurse provides direct nursing care in accordance with established policies, procedures and protocols of the organization. The nurse maintains the knowledge and skills necessary to provide care appropriate to the age of the patients served on the assigned unit. The nurse facilitates the coordination of patient care within the interdisciplinary care team and provides patient education to assure safe patient discharge. Altru Health System is a community of over 3,800 health professionals and support staff committed to caring for the region for more than 100 years. Serving over 225,000 residents in northeast North Dakota and northwest Minnesota, we provide an array of services to meet the needs of patients of all ages and levels of health. As the first member of the Mayo Clinic Care Network, Altru’s providers have access to clinically integrated tools extending Mayo Clinic’s knowledge and expertise to patients. Altru offers challenging and rewarding nursing career opportunities. We are seeking committed, motivated and compassionate nurses to join our team. ""I enjoy working at Altru because of the sense of community."" – Altru Employee. Registered Nurse - North Dakota Board of Nursing (NDBON) or Compact State Agreement; Prior to Start Date Basic Life Support (BLS) - American Heart Assoc. or American Red Cross CPR for Prof. Rescue; Within 2 Months of Start Date EEO Job Types: Full-time, Part-time Pay: $29.19 - $39.22 per hour Schedule: Supplemental Pay: Experience: Relocation Assistance Provided: Company's website: Company's Facebook page: Work Remotely: emergency room nurse dialysis rn emergency department rn nurse manager rn case manager new grad rn Glassdoor has millions of jobs plus salary information, company reviews, and interview questions from people on the inside making it easy to find a job that’s right for you. Glassdoor Employers Community Work With Us Copyright © 2008–2021, Glassdoor, Inc. ""Glassdoor"" and logo are registered trademarks of Glassdoor, Inc. ",,,registered nurse,Part-time,"Bismarck, ND",,"Registered Nurse (RN) $10K-$15K sign-on bonus, Grand Forks, ND","https://www.glassdoor.com/job-listing/registered-nurse-rn-10k-15k-sign-on-bonus-grand-forks-nd-altru-health-system-JV_IC1156224_KO0,56_KE57,76.htm?jl=3788503399&pos=119&ao=1044076&s=58&guid=00000177921a43f79cd1aee6a8351ffc&src=GD_JOB_AD&t=SR&vt=w&ea=1&cs=1_3e42e752&cb=1613063931283&jobListingId=3788503399&ctt=1613063954237"
