Company_name,Company_size,Description,Img_Url,Industry,Job_function,Job_type,Location,Salary,Title,apply_link
RDO Equipment Co.,1001 to 5000 Employees,"Equal Opportunity Employer/Protected Veterans/Individuals with Disabilities The contractor will not discharge or in any other manner discriminate against employees or applicants because they have inquired about, discussed, or disclosed their own pay or the pay of another employee or applicant. However, employees who have access to the compensation information of other employees or applicants as a part of their essential job functions cannot disclose the pay of other employees or applicants to individuals who do not otherwise have access to compensation information, unless the disclosure is (a) in response to a formal complaint or charge, (b) in furtherance of an investigation, proceeding, hearing, or action, including an investigation conducted by the employer, or (c) consistent with the contractor’s legal duty to furnish information. 41 CFR 60-1.35(c) ltl driver tractor trailer driver local driver car hauler forklift driver cdl drivers Glassdoor has millions of jobs plus salary information, company reviews, and interview questions from people on the inside making it easy to find a job that’s right for you. Glassdoor Employers Community Work With Us Copyright © 2008–2021, Glassdoor, Inc. ""Glassdoor"" and logo are registered trademarks of Glassdoor, Inc. ",https://media.glassdoor.com/sql/6447/rdo-equipment-squarelogo-1522702122680.png,"Construction, Repair & Maintenance",truck driver,Full-time,"Bismarck, ND",,Over The Road Truck Driver,https://recruiting2.ultipro.com/RDO1000RDO/JobBoard/b65401d2-4de5-4c2b-851f-556182926250/OpportunityDetail?opportunityId=72cd636d-621e-4e7e-9af5-403e3c8d3833&postingId=a4bbb717-7d62-47dd-8701-94ea7b3965bd&sourceId=d60e73c7-e3c4-4fe0-bf3b-658961ed2284
Midnite Express,N/A,"Drivers can earn up to $.60 per mile to start , based out of our terminal in West Fargo, ND, is looking for qualified   can earn up to $.60 per mile to start with GREAT Incentive Program. Midnite Express has been in business for over 30 years and has consistent long-term relationships with our customers, outstanding service by professional drivers, consistent miles and generous home time. Or call with Questions 1-800-726-8639 Recruiting Job Type: Full-time Pay: Up to $0.60 per mile Benefits: Schedule: Supplemental Pay: Trucking Route: License/Certification: Work Remotely: car hauler independent contractor dump truck driver food grade tanker driver ltl driver heavy haul truck driver Glassdoor has millions of jobs plus salary information, company reviews, and interview questions from people on the inside making it easy to find a job that’s right for you. Glassdoor Employers Community Work With Us Copyright © 2008–2021, Glassdoor, Inc. ""Glassdoor"" and logo are registered trademarks of Glassdoor, Inc. ",,,owner operator,Full-time,"Bismarck, ND",,Class A CDL Truck Drivers - OTR Drivers & Owner Operators,https://www.midniteexpressdrivers.com/?utm_source=GearUp_indeed_allcities&utm_medium=cpc&utm_campaign=indeed
Midco,1001 to 5000 Employees,"Sell digital, sports, and cable network advertising services by recruiting new clients and by providing superior customer experience to retain existing clients.       Midco has been blazing trails since 1931, bringing innovation to the world of telecommunications and delighting customers with exceptional service. Through ambition, imagination and a genuine commitment to each other, Midco proudly serves more than 385,000 residential and business customers in 342 communities in Kansas, Minnesota, North Dakota, South Dakota, and Wisconsin. By 2025, Midco will deploy 10G, the next great leap for broadband – while also expanding its fixed wireless network to rural areas. We’re also dedicated to making our communities better places to live, work and play. Ready to work at Midco? We thought so. Here are a few more reasons why Midco is one of the best places to work: Visit MidcoCareers.com to learn about employment opportunities and apply today. Midco is an Equal Opportunity/Affirmative Action Employer. All qualified applicants will receive consideration for employment without regard to sex, gender identity, sexual orientation, race, color, religion, creed, national origin, disability, protected Veteran status, age, marital status, status with regard to public assistance, familial status, membership or activity in a local commission, or any other characteristic protected by law. To view our full EEO and federal contractor supplemental posters, please refer to Midco.com/FederalPosters. account coordinator sales development representative inside sales manager sales rep sales planner account representative Glassdoor has millions of jobs plus salary information, company reviews, and interview questions from people on the inside making it easy to find a job that’s right for you. Glassdoor Employers Community Work With Us Copyright © 2008–2021, Glassdoor, Inc. ""Glassdoor"" and logo are registered trademarks of Glassdoor, Inc. ",https://media.glassdoor.com/sql/14415/midco-communications-squarelogo-1466096968660.png,Telecommunications,account executive,Full-time,"Bismarck, ND",$34K - $75K ,Advanced Advertising Account Executive,https://recruiting.ultipro.com/MID1014MIDCI/JobBoard/ca97a482-b516-4320-be97-08b06a44002f/OpportunityDetail?opportunityId=48175d7b-94d9-4511-ab07-a6dec9a08a17&postingId=e6c32efa-da7c-489c-8117-2f981c5e985c&__jbsrc=176CAD0C-424F-4E44-9B93-DCFE7146E2CD
US Foods,10000+ Employees,"Join Our Community of Food People! Ready to build a career with a company that’s leading the foodservice industry? Top performers can make up to  / hour plus incentives; our delivery drivers start at       medical, dental, vision, 401K, life insurance, strong safety culture, and much more! stellar local leadership, best place to work, benefits on day ONE! is one of the largest food distributors with a culture and history of promoting from within, excellent training programs and a continuous improvement focus. *  Registering to the FMCSA Clearinghouse is a requirement by the Department of Transportation. All Drivers are required to the Clearinghouse website and register to the new database. The Clearinghouse is a secure online database that provides real-time information about commercial driver’s license (CDL) and commercial learner’s permit (CLP) holders’ drug and alcohol program violations. If you have not registered to the FMCSA database, please note registration is required. Please visit https://clearinghouse.fmcsa.dot.gov/register and click GO to login. If you are able to log into login, but are having trouble with the Clearinghouse registration, see “Clearinghouse Help” field on the clearinghouse page.     Job Type: Full-time Pay: $22.75 per hour Schedule: Trucking Driver Type: License/Certification: Trucking freight handling: Type of Freight: Trucking route: Work Remotely: it-serviceberater telekom analyst servicebereitstellung integration delivery drivers consulting technical manager Glassdoor has millions of jobs plus salary information, company reviews, and interview questions from people on the inside making it easy to find a job that’s right for you. Glassdoor Employers Community Work With Us Copyright © 2008–2021, Glassdoor, Inc. ""Glassdoor"" and logo are registered trademarks of Glassdoor, Inc. ",https://media.glassdoor.com/sql/2856/us-foods-squarelogo-1576537756273.png,Business Services,delivery driver,Full-time,"Bismarck, ND",$18 - $55 Per Hour,"CDL A Delivery Driver - $5,000 Sign On Bonus","https://www.glassdoor.com/job-listing/cdl-a-delivery-driver-5-000-sign-on-bonus-us-foods-JV_IC1156224_KO0,41_KE42,50.htm?jl=3816118886&pos=114&ao=1044077&s=58&guid=00000177921a43f79cd1aee6a8351ffc&src=GD_JOB_AD&t=SR&vt=w&ea=1&cs=1_e317a4b7&cb=1613063931282&jobListingId=3816118886&ctt=1613063991416"
Factory Motor Parts,1001 to 5000 Employees,"Are you someone who has a stimulating influence on nearly everyone they meet? Do you have the talent to be an aggressive closer? Do you provide the competitive drive, outgoing nature and will to be the   Auto Parts Sales Representative we have? Can you grow our auto parts business? For our employees, career challenges and opportunities are limitless. Our steady and continued growth depends on building upon our solid relationships with customers, colleagues and suppliers. We take pride in knowing we are part of an extraordinary company of talented, high-performing professionals who enjoy working in a highly challenging entrepreneurial climate. As an  , you will build Factory Motor Parts business by calling on and selling to new and existing customers to generate business, introduce new product lines, coordinate product seminars and conduct open houses. Minimum requirements include: Drug screen and background check administered as a condition of employment. We are an EEOC/AA Employer. An industry leader, FMP offers well-balanced compensation and benefits programs, which may including medical, dental, vision, life, 401K, profit sharing, paid holidays/vacation/sick time, STD/LTD, + much more. Salary is based on experience and job performance. Location: 2525 Vermont Avenue, Bismarck, ND 58504 Location: 2525 Vermont Avenue, Bismarck, ND 58504 Job Type: Full-time inside sales account manager sales trainee mortgage consultant account representative sales associate sales consultant Glassdoor has millions of jobs plus salary information, company reviews, and interview questions from people on the inside making it easy to find a job that’s right for you. Glassdoor Employers Community Work With Us Copyright © 2008–2021, Glassdoor, Inc. ""Glassdoor"" and logo are registered trademarks of Glassdoor, Inc. ",https://media.glassdoor.com/sql/255781/factory-motor-parts-squarelogo-1416590589871.png,Retail,sales representative,Full-time,"Bismarck, ND",,Sales Representative,"https://www.glassdoor.com/job-listing/sales-representative-factory-motor-parts-JV_IC1156224_KO0,20_KE21,40.htm?jl=3816739554&pos=108&ao=1044077&s=58&guid=00000177921a43f79cd1aee6a8351ffc&src=GD_JOB_AD&t=SR&vt=w&ea=1&cs=1_96630bba&cb=1613063931282&jobListingId=3816739554&ctt=1613064008975"
"Lighthouse Commodities, LLC",N/A,"Lighthouse Commodities, LLC (LHC) has extensive commodity trading and risk management experience across grain production, cattle feeding, and commodity processing industries. Since 2015, LHC has leveraged this experience to bring professional risk management, hedging and merchandising services to our farm clients. Lighthouse Commodities, LLC is seeking an established Accountant to fill a new role. This role will be responsible for assisting the CFO by performing various grain accounting duties. KEY RESPONSIBILITIES · Preparing accurate and timely producer grain settlements · Requesting and matching destination grain settlements · Creating and maintaining commodity discount schedules as needed · Freight Invoice Processing · AP/AR entry of commodity purchases and sales and general business expenses · Assisting with Accounts Receivable collections and credit application processing · Responding to Client settlement and payment questions and other reporting requests · Performing daily balancing of the Daily Position Report (DPR) and other risk/position reports · Assisting with month-end and year-end accounting functions KEY SKILLS and STRENGTHS · Experience with commodity accounting systems and software · Experience with Accounts Payable and Accounts Receivable · Proficiency in Microsoft Office suite · Remarkable attention to detail and commitment to accuracy · Ability to work independently, in a high stress environment and effectively manage multiple priorities and tasks simultaneously Work schedule will primarily be normal daytime business hours, Monday through Friday, with additional hours required as needed. Associates degree in Accounting · Bachelor’s Degree in Accounting · 3+ years of relevant work experience with a grain or commodity company · Understanding of commodity grain accounting processes Job Type: Full-time Pay: $60,000.00 - $65,000.00 per hour Benefits: Schedule: Supplemental Pay: Work Location: Job Duties: This Company Describes Its Culture as: Company's website: Company's Facebook page: Benefit Conditions: Work Remotely: audit senior book keeper budget analyst tax manager tax analyst staff auditor Glassdoor has millions of jobs plus salary information, company reviews, and interview questions from people on the inside making it easy to find a job that’s right for you. Glassdoor Employers Community Work With Us Copyright © 2008–2021, Glassdoor, Inc. ""Glassdoor"" and logo are registered trademarks of Glassdoor, Inc. ",,,accountant,Full-time,"Bismarck, ND",,Accountant,"https://www.glassdoor.com/job-listing/accountant-lighthouse-commodities-JV_IC1156224_KO0,10_KE11,33.htm?jl=3801561397&pos=112&ao=1044077&s=58&guid=00000177921a43f79cd1aee6a8351ffc&src=GD_JOB_AD&t=SR&vt=w&ea=1&cs=1_59bca689&cb=1613063931282&jobListingId=3801561397&ctt=1613064009533"
leela & lavender,1 to 50 Employees,"PT Boutique Sales Lead  Love Retail and want FLEXIBLE HOURS? We want to hear from you! Sales Leads help inspire all women in their style adventures & drive business goals. You must have a fabulous personal sense of style and super strong, positive communication skills, self-starter. A passion for fashion and a love for making connections with everyone is a must! At leela & lavender, our Sales Lead works as a team with our Store Manager to create a unique shop experience. Hours of Operations: M-F 10a - 7p Sat 10a - 6p Sun 12p - 4p Job Type: Part-time Job Type: Part-time Benefits: Schedule: Work Location: Paid Training: Management: Typical start time: Typical end time: Company's website: Work Remotely: oem sales manager regional sales manager area sales and marketing manager regional sales and marketing manager sales manager channel sales manager Glassdoor has millions of jobs plus salary information, company reviews, and interview questions from people on the inside making it easy to find a job that’s right for you. Glassdoor Employers Community Work With Us Copyright © 2008–2021, Glassdoor, Inc. ""Glassdoor"" and logo are registered trademarks of Glassdoor, Inc. ",,Retail,sales manager,Part-time,"Bismarck, ND",,Sales Leader - Boutique,"https://www.glassdoor.com/job-listing/sales-leader-boutique-leela-lavender-JV_IC1156224_KO0,21_KE22,36.htm?jl=3822348017&pos=111&ao=1044077&s=58&guid=00000177921a43f79cd1aee6a8351ffc&src=GD_JOB_AD&t=SR&vt=w&ea=1&cs=1_77f968b8&cb=1613063931282&jobListingId=3822348017&ctt=1613064009104"
Bystronic,1001 to 5000 Employees,"The Capital Equipment Field Service Engineer will be responsible for installing, troubleshooting and repairing Bystronic Laser and Press Brake Machines. · Install, repair, commission and troubleshoot machine tools. · Enter service reports. · Diagnose mechanical, and electrical problems, performing mechanical and electrical repairs, install new machines. · Instruct customer on machine operation, and maintenance and safety at customer locations. · Associates program or technical school degree in engineering principles. · Two (2) year degree or higher preferred, or four years military experience in Electrical/Mechanical systems or 1-3 years industry experience. · 1-3 years machine tool field and installation knowledge · Electrical and mechanical machine troubleshooting experience. · Be able to work overtime and including weekends as needed. · 100% travel to the North America’s · Have and maintain a clean and valid driver’s license and be able to rent a car. · Have or be able to obtain a Passport. · Be able to lift up to 70 lbs. · Excellent communication skills oral and written. · Advanced computer skills including Microsoft Office · Positive, professional attitude and customer service background. · Possess a basic took kit own, special tools will be supplied. · Possess a mechanical and electrical background. · Ability to read and understand electrical and mechanical drawings. · Understanding of I/O modules, servo amplifiers, electrical components in control cabinets. · Understands the relationship between axis motors and feedback systems for each axis. : · Experience in electrical, hydraulics, Ehtercat, ethernet, pneumatics electronics and blueprint reading *All qualified applicants will receive consideration for employment without regard to race, color, religion, sex, sexual orientation, gender identity, national origin, citizenship, disability or protected veteran status **NOTE: This job description in no way states or implies that these are the only duties to be performed** Job Type: Full-time Pay: From $25.00 per hour Education: Experience: Willingness To Travel: field support engineer field engineer field service manager field clinical engineer customer engineer biomedical technician Glassdoor has millions of jobs plus salary information, company reviews, and interview questions from people on the inside making it easy to find a job that’s right for you. Glassdoor Employers Community Work With Us Copyright © 2008–2021, Glassdoor, Inc. ""Glassdoor"" and logo are registered trademarks of Glassdoor, Inc. ",https://media.glassdoor.com/sql/779293/bystronic-squarelogo-1550558588382.png,Manufacturing,field service engineer,Full-time,"Bismarck, ND",$42K - $69K ,Capital Equipment Field Service Engineer,"https://www.glassdoor.com/job-listing/capital-equipment-field-service-engineer-bystronic-JV_IC1156224_KO0,40_KE41,50.htm?jl=3813618954&pos=107&ao=1044077&s=58&guid=00000177921a43f79cd1aee6a8351ffc&src=GD_JOB_AD&t=SR&vt=w&ea=1&cs=1_1dc8df0f&cb=1613063931281&jobListingId=3813618954&ctt=1613064009549"
Prairie Sinus Ear & Allergy P.C.,N/A,"“Re-define healthcare! Can do attitudes carry self starters at progressive company to benefit patients here. Competitive wage & benefits.” We are seeking NURSING OR MEDICAL ASSISTANT STAFF to join our team in a multi-faceted role, as we re-define healthcare in Bismarck. : Company address: 3000 North 14th St 3rd Floor Bismarck, N.D. Telephone inquiries will be redirected to web applications through Indeed. Job Type: Full-time Pay: $33,937.00 - $64,000.00 per year Benefits: Medical Specialty: Schedule: Supplemental Pay: COVID-19 considerations: Covid-19 enhanced protective environment in place including air sanitization, patient screening, and remote advanced intake. License/Certification: Company's website: Benefit Conditions: Work Remotely: COVID-19 Precaution(s): assistant nurse manager rn lactation consultant licenced vocational nurse nurse residency program licensed vocational nurse assisted living administrator Glassdoor has millions of jobs plus salary information, company reviews, and interview questions from people on the inside making it easy to find a job that’s right for you. Glassdoor Employers Community Work With Us Copyright © 2008–2021, Glassdoor, Inc. ""Glassdoor"" and logo are registered trademarks of Glassdoor, Inc. ",,,registered nurse,Full-time,"Bismarck, ND",,NURSE / RN / LPN / CERTIFIED MEDICAL ASSISTANT,"https://www.glassdoor.com/job-listing/nurse-rn-lpn-certified-medical-assistant-prairie-sinus-ear-allergy-pc-JV_IC1156224_KO0,40_KE41,69.htm?jl=3784903301&pos=110&ao=1044077&s=58&guid=00000177921a43f79cd1aee6a8351ffc&src=GD_JOB_AD&t=SR&vt=w&ea=1&cs=1_e4cbf03f&cb=1613063931282&jobListingId=3784903301&ctt=1613064008947"
"Prairie View Landscaping & Nursery, Inc.",N/A,"Become a team member with a well-established company that is a leader in the green industry. Prairie View Landscaping & Nursery, Inc. has been serving the Bismarck, Mandan and surrounding areas since we were founded in 2005. We employ a team of about 120 talented professionals across four main divisions. Our full range of services includes commercial and residential landscape design and installation, landscape maintenance, irrigation service, aggregate and soil delivery, excavating, and commercial snow removal. In addition to the landscaping side of our business, Prairie View is also a grower of premium nursery stock on about 60 acres. Administrative headquarters located in Baldwin, ND about 6 miles north of Bismarck. The nursery supplies plant material to landscapers and retail customers, as well as providing for our own landscaping projects. We take on all kinds of projects, large or small. Job Type: Full-time Pay: $65,000.00 - $120,000.00 per year Benefits: Schedule: Work Location: Benefit Conditions: Work Remotely: landscape designer project designer landscape architecture architectural drafter project architect landscape architectural designer urban designer Glassdoor has millions of jobs plus salary information, company reviews, and interview questions from people on the inside making it easy to find a job that’s right for you. Glassdoor Employers Community Work With Us Copyright © 2008–2021, Glassdoor, Inc. ""Glassdoor"" and logo are registered trademarks of Glassdoor, Inc. ",,,landscape architect,Full-time,"Bismarck, ND",,Landscape Design & Sales,"https://www.glassdoor.com/job-listing/landscape-design-sales-prairie-view-landscaping-nursery-JV_IC1156224_KO0,22_KE23,55.htm?jl=3813180648&pos=101&ao=1044077&s=58&guid=00000177921a43f79cd1aee6a8351ffc&src=GD_JOB_AD&t=SR&vt=w&ea=1&cs=1_904ecd38&cb=1613063931276&jobListingId=3813180648&ctt=1613064013602"
Yanish Custom Exteriors,N/A,"Yanish Custom Exteriors, a well established local company, is currently hiring for Carpenters to install windows, siding and complete small remodel projects. Experience preferred, wage depends on experience. Competitive wage and benefit package offered for full time employees. Please contact Gene or Lance at 701-255-4770 if interested. Job Type: Full-time Pay: $18.00 - $30.00 per hour Experience: night shift building maintenance engineer electric glass installer hvac installer auto glass installer hvac helper hvac maintenance technician Glassdoor has millions of jobs plus salary information, company reviews, and interview questions from people on the inside making it easy to find a job that’s right for you. Glassdoor Employers Community Work With Us Copyright © 2008–2021, Glassdoor, Inc. ""Glassdoor"" and logo are registered trademarks of Glassdoor, Inc. ",,,installer,Full-time,"Bismarck, ND",,Lead Carpenter/ Window Installer,"https://www.glassdoor.com/job-listing/lead-carpenter-window-installer-yanish-custom-exteriors-JV_IC1156224_KO0,31_KE32,55.htm?jl=3810564903&pos=104&ao=1044077&s=58&guid=00000177921a43f79cd1aee6a8351ffc&src=GD_JOB_AD&t=SR&vt=w&ea=1&cs=1_7a288087&cb=1613063931279&jobListingId=3810564903&ctt=1613064013592"
